{
  "$schema": "https://json-schema.org/draft/2020-12/schema",
  "$id": "https://schemas.ukma.dev/v1/memory.page_in.request.schema.json",
  "title": "memory.page_in Request",
  "type": "object",
  "additionalProperties": false,
  "required": [
    "api_version",
    "operation",
    "context",
    "input"
  ],
  "properties": {
    "api_version": {
      "const": "1"
    },
    "operation": {
      "const": "ukma.memory.page_in.v1"
    },
    "context": {
      "$ref": "shared.schema.json#/$defs/RequestContext"
    },
    "input": {
      "$ref": "wire.schema.json#/$defs/PageIn"
    }
  }
}
